3406,OPEN,Slice by 0-dimensional np.array,good first issue, array,2021-10-24T22:40:39Z
3403,OPEN,Multiply reduces partitions,dataframe,2018-10-24T19:17:05Z
3402,CLOSED,Write parquet sometimes doesn't clear tasks,,2018-04-13T17:20:13Z
3401,CLOSED,DataFrame read_hdf sorted_index=True forces npartitions to 1,,2018-06-14T19:33:07Z
3400,CLOSED,Persist or caching behavior question,,2018-10-24T19:17:37Z
3399,CLOSED,CommClosedError when using own Jupyter on Kubernetes,,2018-04-13T17:28:21Z
3398,CLOSED,Improving the docs of advanced features,,2019-08-12T13:23:32Z
3397,CLOSED,Dask datasets submodule,,2018-10-24T19:18:30Z
3396,CLOSED,Risk attribution: a[argsort(b)[:k]],,2018-07-05T17:01:42Z
3395,CLOSED,Recursive topk,,2018-04-23T05:32:14Z
3393,CLOSED,read_sql_table is not working correctly,,2018-04-12T14:54:56Z
3392,CLOSED,Series comparison to NumPy scalar fails,,2018-05-01T19:02:19Z
3390,CLOSED,Dataframe from_delayed with inconsistent column ordering after set_index,,2018-10-24T19:19:14Z
3388,CLOSED,isin issue with numpy 1.12 on Python 2,,2018-04-16T23:34:55Z
3386,CLOSED,Temporary directory options,,2019-01-22T11:11:50Z
3384,CLOSED,Dataframes: divisions vs partition (min, max) and other partfile stats?,dataframe, needs info,2021-10-19T14:12:50Z
3383,CLOSED,ENH: Preserve DataFrame divisions when reading from parquet using pyarrow,,2018-04-17T15:37:56Z
3382,CLOSED,Adding Dask get_options,,2018-04-10T02:02:12Z
3379,CLOSED,Orc tests fail intermittently,,2018-04-06T18:40:32Z
3377,OPEN,Option to compute several moments at once,array,2021-10-12T05:50:42Z
3376,CLOSED,Dataframe index is not sorted after `.set_index()`,good first issue,2019-05-16T21:56:00Z
3372,CLOSED,Dask with Kubernetes documentation issue,,2018-04-04T17:15:36Z
3369,CLOSED,Cannot pickle function decorated with @delayed,,2018-04-03T13:18:46Z
3367,CLOSED,Configuration files,,2018-05-05T23:09:23Z
3361,CLOSED,dask groupby apply give weird indexes,,2019-08-08T15:46:42Z
3355,OPEN,Support arrays with unknown lengths in broadcast_arrays,array,2018-04-19T13:28:05Z
3354,CLOSED,Can't pickle csv.reader(),,2018-04-19T13:24:53Z
3352,CLOSED,Branding dataframe reprs,,2018-10-24T18:53:53Z
3351,CLOSED,Can't save array using distributed scheduler,,2018-10-24T18:53:38Z
3348,CLOSED,ImportError: cannot import name methods,,2023-02-16T01:35:24Z
3347,CLOSED,Subsetting 2x throws error,,2018-10-24T18:52:57Z
3345,CLOSED,CI test failures with pyarrow and hdfs,,2018-08-06T23:33:23Z
3344,CLOSED,Named Graphs/Pipelines,,2018-10-24T18:52:42Z
3342,CLOSED,DataFrame: Splitting a list to multiple columns is throwing error,,2018-03-30T12:04:18Z
3339,CLOSED,Creating a dask signal processing package,,2018-10-24T18:52:26Z
3336,CLOSED,Add examples and infrastructure to the dask-examples repository,good first issue, documentation,2018-10-24T18:51:20Z
3333,CLOSED,Left merging two dataframes lead to an empty Dataframe as a result,dataframe,2023-01-31T14:52:40Z
3329,OPEN,Override optimization strategy of Dask Collection instance,,2018-03-25T23:30:04Z
3324,CLOSED,DataFrame.describe : got an unexpected keyword argument 'include',,2018-10-24T18:49:19Z
3322,CLOSED,Salting terminal keys,,2018-11-02T20:28:42Z
3318,CLOSED,custom node names in graphs,,2018-03-30T08:06:12Z
3317,CLOSED,delayed class method,,2018-07-14T21:09:01Z
3314,CLOSED,Adding a fire_and_forget function,,2021-10-19T14:13:41Z
3306,CLOSED,dask.dataframe map_partitions func return type?,,2018-03-23T06:17:00Z
3304,CLOSED,Release,,2018-03-21T18:56:33Z
3302,OPEN,Method to make uniformly chunked Dask Arrays,array,2018-05-02T16:27:50Z
3299,CLOSED,store in unreliable targets,,2018-03-20T00:31:38Z
3297,CLOSED,dask.dataframe __getitem__ does not work with subclasses of str in python 3.6,,2018-05-02T22:46:16Z
3295,CLOSED,ModuleNotFoundError: No module named 'dask.bag',,2018-04-05T16:49:03Z
3293,CLOSED,Converting Dask Array of unknown shape to known shape (at the cost of computing),array,2019-09-10T15:56:26Z
3292,CLOSED,dask.dataframe.DataFrame.at alternative,,2018-10-24T18:45:35Z
3291,CLOSED,Optimizing nested cross-validation: speedups even in single-machine cases,,2019-02-21T09:18:23Z
3290,CLOSED,Exception when slicing array of length one with True boolean list/array,array,2018-08-02T06:44:18Z
3289,CLOSED,FutureWarning handling fill value for masked array of datetime64,,2019-08-09T19:33:46Z
3288,CLOSED,to_parquet default compression is `None` not `snappy`,,2018-04-04T17:51:19Z
3287,CLOSED,Note optional scipy requirement,,2018-10-24T18:39:58Z
3281,OPEN,Explore wrapping Intel's mkl_fft,array,2018-08-06T18:49:02Z
3280,OPEN,Support norm in dask.array.fft,array,2018-03-13T01:06:16Z
3279,CLOSED,dask.distributed Client freezes after recent software upgrade.,,2018-03-27T21:42:18Z
3278,OPEN,Support arbitrary kwargs in dask.array.fft,array,2018-03-13T01:06:39Z
3277,OPEN,Improve dask.array.fft's error messages,array,2018-10-24T18:36:01Z
3276,CLOSED,Cannot use multiprocessing with cythonized code,,2018-05-25T02:03:44Z
3274,CLOSED,Adding a to_chunks method to Dask Collections,,2018-07-01T11:19:11Z
3273,CLOSED,Dask Dataframe Delayed section docs,dataframe, documentation,2018-10-24T18:35:16Z
3272,CLOSED,Update docs (Apache Impala graduated),dataframe, documentation,2018-03-20T21:12:43Z
3269,CLOSED,BUG: Dask dataframe cannot handle string index,dataframe,2021-11-04T20:12:24Z
3268,CLOSED,read_parquet needs to finish first, if it's the second time it's been called,,2018-05-25T01:51:14Z
3266,CLOSED,Array's `vindex` shuffles dimensions,,2018-03-10T07:12:22Z
3265,CLOSED,Improving docstring wrapping functions,good first issue, documentation,2019-05-07T14:55:54Z
3264,CLOSED,Resource dependent tasks do not get re-distributed,,2020-06-25T13:09:33Z
3263,CLOSED,map_blocks converts dask arrays kwargs to strings,array,2021-10-12T08:48:47Z
3259,CLOSED,Support `axis` kwarg in `squeeze` method,array,2018-03-09T22:09:15Z
3258,CLOSED,Documenting NumPy functions that work fine with Dask Arrays,good first issue, array, documentation,2023-07-25T15:57:42Z
3255,OPEN,Safely pass a file-like object to dask store,array, io,2021-10-12T04:03:02Z
3253,CLOSED,Custom scheduler - Celery?,scheduler,2018-10-24T18:27:33Z
3252,CLOSED,dask.Bag slow and very large memory consumption with join,bag,2018-03-10T14:07:30Z
3251,CLOSED,`df.values` has unspecified length,,2018-03-11T21:38:04Z
3250,OPEN,Dask implementation of discrete sinusoid transformation,array,2018-09-02T23:10:58Z
3248,CLOSED,optimization of array.concatenate depends strongly on endianness,array,2018-03-19T17:49:20Z
3247,OPEN,Dask holding on to memory after garbage collection,,2020-09-30T09:33:56Z
3245,OPEN,Silencing warnings issued by numpy functions within dask.array,array,2023-04-18T14:01:56Z
3244,CLOSED,Can we do "daskification" of a pointwise array function operating on numpy arrays?,,2018-03-05T16:09:37Z
3243,CLOSED,Quickstart document per collection,,2018-10-24T18:23:27Z
3242,CLOSED,Intermediate compute() fails even though whole graph works fine,,2018-10-24T18:23:00Z
3241,CLOSED,distributed and/or asynchronous algorithms for numeric methods,,2018-10-24T18:22:40Z
3240,CLOSED,Prepare for pandas extension arrays,dataframe,2019-01-15T19:01:40Z
3239,CLOSED,dask dataframe alias isna to isnull.,good first issue, dataframe,2018-05-25T01:53:41Z
3237,CLOSED,Consolidation between Dask with/without Distributed,scheduler,2018-10-24T18:22:08Z
3236,CLOSED,dataframe map_partitions doesn't resolve future arguments,,2018-03-18T21:12:18Z
3235,CLOSED,Launching tasks within tasks without using the distributed scheduler,,2019-06-24T14:57:29Z
3234,CLOSED,Make _Groupby.apply take additional arguments.,,2018-03-18T21:12:14Z
3232,CLOSED,BUG: inline fails with user supplied keys,,2018-10-24T18:11:49Z
3231,CLOSED,Return file names on `to_parquet`,,2019-07-12T13:34:10Z
3227,CLOSED,Error using df.index in and condition,,2018-03-09T15:11:03Z
3226,CLOSED,Requirements for 1.0.0 release,,2018-11-29T16:36:56Z
3225,CLOSED,Dask: ValueError: Length mismatch: Expected axis has 2 elements, new values have 238 elements,,2019-01-24T20:55:37Z
3223,CLOSED,Membership policies,community,2018-10-24T18:07:11Z
3221,CLOSED,CI failures against dev dependencies,,2018-10-24T18:07:01Z
3220,CLOSED,CI timeouts,,2018-10-24T17:59:14Z
3211,CLOSED,Dask Array vindex doesn't allow identity,array,2018-06-10T13:40:46Z
3209,CLOSED,Implementing broadcast_arrays,array,2018-02-27T18:08:27Z
3208,OPEN,Supporting more ufunc methods,array,2019-08-08T00:30:25Z
3206,CLOSED,Dask Dataframe Groupby 'First'/'Last' with agg function,good first issue, dataframe,2018-05-25T01:55:19Z
3205,CLOSED,`isnull` takes a long time,,2018-02-24T15:02:59Z
3204,CLOSED,I read a 9G csv with 2 workers using 30min,,2018-02-24T16:56:46Z
3203,CLOSED,'dask.array.image' not found,,2018-02-23T19:59:24Z
3198,CLOSED,Dataframe isin function with strange behaviour on large lists,,2019-05-23T22:52:25Z
3197,CLOSED,Groupby-Apply runs function twice for each group,,2019-09-13T13:40:07Z
3195,CLOSED,dask/dataframe/core.py imports toolz, which isn't installed,,2018-02-22T18:16:17Z
3194,OPEN,Dask Arrays with unknown length fail on ravel,array,2021-03-31T09:07:00Z
3192,CLOSED,Release 0.17.1,,2018-02-22T21:25:38Z
3190,CLOSED,Argmax fails on newer dask versions.,array,2018-02-22T20:46:17Z
3189,CLOSED,overflow error,,2018-10-24T17:58:13Z
3186,CLOSED,[Request] In Dask, can't list partitions possible values, from a partitioned Parquet File,io,2019-08-13T14:26:47Z
3184,CLOSED,Indexing with conditional array gives incorrect ordering,array,2019-08-06T15:02:23Z
3183,CLOSED,How to compare 2 dataframes to see what is missing in each? (Not in memory),dataframe, needs info,2021-10-19T14:01:02Z
3181,CLOSED,Unable to read from HDFS in Dask,,2018-09-19T05:17:56Z
3176,CLOSED,Dask Array: Broadcasting Error?,dataframe, array,2019-08-13T14:28:01Z
3175,CLOSED,Dask Array: Integer Repeat Error?,dataframe, array,2018-02-22T21:11:55Z
3174,CLOSED,Update Dask landing page?,,2018-03-27T17:53:47Z
3173,CLOSED,Batcher sort comparison,,2018-10-24T17:55:51Z
3172,CLOSED,FAQ is out of date,,2018-05-25T01:55:27Z
3170,CLOSED,Value error raised when looking at a column in a partitioned parquet file.,,2018-02-20T17:01:08Z
3168,CLOSED,[BUG?] Not able to filter and load a partitioned parquet file using dask,,2018-02-20T17:01:08Z
3166,CLOSED,dask.array.indices incorrectly sets up chunks for each dimension,,2018-02-14T17:58:30Z
3165,CLOSED,Example point to an old notebook,,2018-10-24T17:55:46Z
3163,CLOSED,read_parquet unable to load list of hdfs files,,2018-02-27T14:51:07Z
3162,OPEN,Arithmetic operations of dtype arrays raise ValueError,array,2019-08-13T14:30:15Z
3159,CLOSED,â€œColumn Assignment Doesn't Support Timestampâ€,,2018-02-17T17:10:26Z
3158,CLOSED,request: HTTP file system,,2018-02-22T16:30:29Z
3156,CLOSED,LZ4_compress and LZ4_uncompress removed,,2018-02-11T00:45:49Z
3148,CLOSED,Integrating dask in vaex, some questions,,2018-05-25T07:56:03Z
3146,CLOSED,Make inlined functions list extensible,,2018-10-24T17:54:21Z
3145,CLOSED,Custom exceptions in custom graphs can't be reconstructed in main process when multiprocessing,,2018-02-07T15:59:04Z
3141,CLOSED,[pyarrow] Passing `partition_on` when writing parquet files ignores keyword parameters,,2018-02-06T17:33:38Z
3140,CLOSED,Add page for base API to docs,,2018-03-09T15:12:41Z
3139,CLOSED,Memory-inefficient ordering related to rechunk,,2018-10-24T17:53:53Z
3138,CLOSED,DataFrame.map_partitions-like method that returns a dask.array,,2018-02-09T18:15:05Z
3136,CLOSED,No actual CPU/memory usage on Web UI after upgrading to distributed-1.20.2/dask-0.16.0,,2018-10-24T17:55:51Z
3135,OPEN,Unexpected dataframe shuffle for sorted index,dataframe,2021-10-12T04:37:01Z
3134,CLOSED,Problems with Community Discussion Policy,,2018-02-14T00:00:11Z
3133,CLOSED,`sum` requires dtype argument for object array.,good first issue, array,2018-02-06T19:18:18Z
3131,CLOSED,Question: Rolling calculation and sharing adjacent rows,,2018-02-02T21:12:21Z
3130,CLOSED,Writing partitioned parquet fails with fastparquet 0.1.4,,2018-02-06T19:16:17Z
3125,CLOSED,dask.dataframe.read_parquet nanosecond index divisions are None,,2022-05-20T15:38:43Z
3121,CLOSED,Support for Google BigQuery,dataframe, io,2021-12-20T19:58:04Z
3115,CLOSED,Errors in quantile calculation,,2018-01-30T15:27:11Z
3113,CLOSED,Didn't know which `TimeoutError` to catch - maybe the docs could be updated?,,2018-01-31T15:23:30Z
3112,CLOSED,dask_dev twitter account permissions,,2018-10-24T17:47:43Z
3111,CLOSED,Dask image subpackage,,2018-10-24T19:25:50Z
3108,CLOSED,da.argmin of unique's result,array,2018-10-24T21:21:40Z
3106,CLOSED,BUG: da.percentile silently returns nan for array of unknown length,,2018-01-31T14:02:43Z
3105,CLOSED,df.to_parquet fails with thrift=0.11.0,,2018-01-26T15:55:22Z
3104,CLOSED,dd.read_parquet no longer include index columns,,2018-02-09T18:57:07Z
3101,CLOSED,graphviz and python-graphviz missing during conda install dask,,2018-01-25T14:23:33Z
3099,CLOSED,da.percentile and np.percentile mismatch,,2018-10-24T17:34:40Z
3098,CLOSED,Appending to parquet file seems to break future appending,dataframe, io, parquet,2022-05-05T15:03:24Z
3096,CLOSED,Indexing a dask array with another dask array,array,2018-10-30T13:43:51Z
3095,CLOSED,Tutorial: cant load file,,2018-10-24T17:31:31Z
3094,CLOSED,da.minimum uses lots of memory.,,2018-01-23T17:18:59Z
3093,CLOSED,DataFrame .query with local_dict fails,,2018-02-07T06:52:10Z
3092,CLOSED,Reduction over arrays with broadcastable numblocks,,2019-08-08T15:30:30Z
3090,CLOSED,Add DataFrame.to_dask_array,good first issue, dataframe,2018-08-20T16:26:05Z
3089,CLOSED,Profiler, and CacheProfiler return empty lists,,2018-01-22T03:40:47Z
3086,CLOSED,Caching conda packages on CI,,2019-08-13T14:34:29Z
3084,CLOSED,fastparquet tests failing,,2018-01-31T16:29:03Z
3081,CLOSED,map_blocks can't detect block_id keyword in func(*args, block_id=None),array,2018-10-24T17:02:04Z
3074,OPEN,Multiprocess writes using `to_hdf5`,array, io,2021-10-12T04:39:39Z
3070,CLOSED,nout keyword for da.map_blocks,array,2018-01-23T15:59:58Z
3068,CLOSED,dask.delayed not using dask.cache inside delayed function,,2018-01-15T22:51:59Z
3065,CLOSED,Define Dask array with known numblocks but unknown chunks.,,2018-01-13T15:39:11Z
3063,CLOSED,map_blocks accepting broadcastable arrays and returning multiple arrays.,,2018-01-15T19:44:05Z
3062,CLOSED,Worker memory leak when sending arrays to cluster,,2018-01-12T17:12:05Z
3061,CLOSED,to_delayed always optimizes,good first issue, array,2018-02-01T22:04:42Z
3058,CLOSED,len(dask scalar) gives an error,good first issue, array,2018-01-15T16:12:33Z
3055,CLOSED,Another task ordering issue,,2018-01-14T18:45:14Z
3054,CLOSED,Tokenize produces inconsistent results with sparse scipy arrays,good first issue,2018-01-14T16:26:37Z
3052,CLOSED,Release new (minor) version,,2018-01-09T21:30:42Z
3051,CLOSED,Release new (minor,,2018-01-08T22:27:22Z
3049,CLOSED,Slicing list/array issue,array,2018-01-18T18:11:18Z
3048,CLOSED,dask.dataframe.DataFrame.apply: meta dtypes are not applied,dataframe,2018-10-24T17:00:40Z
3047,CLOSED,dask.dataframe.groupby with tuple keys fails,dataframe,2020-09-11T14:59:20Z
3046,CLOSED,Support hdfs filesystem(s) from pyarrow,,2018-02-01T23:59:02Z
3044,CLOSED,Implement the __array_ufunc__ protocol on Series and DataFrame objects,good first issue, dataframe,2018-06-15T11:37:51Z
3043,CLOSED,Allow failures in development tests,,2018-01-23T19:32:29Z
3039,CLOSED,CI failures with pandas master,dataframe,2018-01-02T20:15:29Z
3038,CLOSED,Meta not updated correctly with MultiIndex while using Accessor functions in DataFrame,,2018-02-06T20:52:20Z
3037,CLOSED,repeated cumsum on dataframe returns the results of the first cumsum,,2018-01-04T12:33:40Z
3036,CLOSED,dask.Dataframe.to_parquet fail with Category column,,2019-06-20T20:57:54Z
3034,CLOSED,Count aggregate fails on simple DataFrame,,2018-01-02T20:26:17Z
3033,CLOSED,How can i implement the parallel version of kmeans?,,2018-01-09T21:05:32Z
3032,CLOSED,DataFrame.resample(...).mean() generates NaN for all but first partition?,dataframe,2020-06-01T21:08:22Z
3031,CLOSED,Installing dask-tensorflow failed on windows machine with python 3.6,,2017-12-26T20:04:36Z
3029,CLOSED,QUESTION: read_sql_table() - how to specify table name in specific database?,good first issue, documentation,2018-10-24T16:55:34Z
3023,CLOSED,Pull request policy,,2017-12-21T20:36:35Z
3020,CLOSED,Percentile doesn't work on scalars,,2017-12-21T18:21:35Z
3018,CLOSED,FUSE for Dask filesystem wrappers,,2018-10-24T16:54:20Z
3015,CLOSED,Dask objects inspection failing, issues with graph,,2017-12-23T18:25:14Z
3013,CLOSED,Graph prioritization problem,,2018-10-24T16:54:10Z
3011,CLOSED,Parquet PyArrow tests failing,,2017-12-21T16:27:57Z
3010,CLOSED,Exception when converting int64 column to categorical then outputting to parquet,dataframe,2021-10-19T14:11:24Z
3008,CLOSED,ddf.to_parquet(append=True) error when file not existing,dataframe,2018-01-25T18:44:16Z
3007,CLOSED,Experiment with CuPy GPU arrays,,2018-10-24T16:53:36Z
3006,CLOSED,dask dataframe set_index NotImplementedError,dataframe,2019-04-30T15:08:58Z
3004,CLOSED,Cumsum in dask.dataframe does not work with empty partitions,dataframe,2020-09-11T15:03:02Z
3003,CLOSED,ddf.index.name is set to None after assign,good first issue, dataframe,2022-04-25T12:38:14Z
3002,CLOSED,Implement .str.cat,dataframe,2018-01-03T04:09:35Z
2999,OPEN,Groupby-agg on index with known divisions results in unknown divisions,dataframe,2021-10-12T04:45:32Z
2996,CLOSED,read_csv failure on pandas master,,2017-12-14T23:50:28Z
2994,CLOSED,Indexing a dask array with a decreasing slice results in negative dimension size,array,2018-10-24T21:30:32Z
2992,CLOSED,Option for progress bar to show key of the task being computed?,,2017-12-21T18:32:05Z
2991,OPEN,read_parquet() does not capture divisions when partitioned,dataframe, io,2021-10-12T04:46:12Z
2990,CLOSED,Visualization of more than 100% CPU usage,,2021-06-15T17:49:44Z
2988,CLOSED,`dask.array.nanmean()` generates unstable name (hash),array,2017-12-23T23:18:16Z
2985,CLOSED,Using `to_parquet` with `pyarrow` fails on compression argument,,2017-12-14T15:35:05Z
2984,CLOSED,Number of blocks mismatch for 1st dimension,,2017-12-11T07:54:57Z
2983,CLOSED,memory blowing up when using set_index, groupby,needs info,2021-04-17T10:47:45Z
2982,CLOSED,DataFrame.set_index(..., compute=False) triggers computation,dataframe, documentation,2019-07-14T14:14:08Z
2981,CLOSED,Modify `dask.array.meshgrid` to not producing rechunking operations,array,2017-12-17T19:12:10Z
2977,CLOSED,Exposing chunk array types in dask.array (e.g., sparsed and masked),array,2019-06-07T00:07:25Z
2976,CLOSED,read_csv reads header row multiple times,,2017-12-21T16:32:00Z
2975,CLOSED,read_sql_table gives AttributeError when reading a database,good first issue, dataframe,2018-11-08T20:51:01Z
2974,CLOSED,read_sql returns "Metadata mismatch" when part of column is Null,,2018-10-24T14:58:28Z
2972,CLOSED,Tags for Docker images and Helm charts,,2018-10-24T14:47:48Z
2968,CLOSED,DASK Debug strategy?,,2017-12-07T12:50:36Z
2966,CLOSED,Dask.distributed setup documentation,,2017-12-21T18:24:26Z
2965,CLOSED,Corner cases for topk of array,array,2018-04-23T05:32:14Z
2961,OPEN,Dask array getitem scalar vs 0-D array,array,2018-06-13T20:43:47Z
2959,OPEN,Implementing `item` method for Dask Arrays,array,2018-06-17T04:35:11Z
2957,CLOSED,Understanding read_csv ?,,2017-12-04T18:05:15Z
2956,CLOSED,Better Dask Array support of `frompyfunc`,array,2017-12-25T07:56:57Z
2953,CLOSED,Alternative for reducing array to more than 1 element along axes of reduction.,array,2018-10-24T14:27:34Z
2952,CLOSED,can't drop duplicated on dask dataframe index,dataframe,2020-06-03T15:23:43Z
2951,CLOSED,Array sum dtype not same as numpy's,,2017-12-03T04:40:28Z
2950,CLOSED,ENH: Support merging Dask DataFrames on a combination of columns and index levels,dataframe,2017-12-11T12:44:59Z
2949,CLOSED,DASK (latest from GIT), Pandas 0.21, (inplace parameter for rename, fillna),,2018-01-02T19:52:05Z
2948,CLOSED,`bool(df == df)` not ambiguous,,2017-12-13T15:41:45Z
2947,CLOSED,astype CategoricalDtype on unknown categorical is still unknown,,2017-12-21T18:54:34Z
2946,OPEN,da.repeat with `repeats` as list NotImplemented,array,2018-02-22T21:13:42Z
2945,CLOSED,Community Communication,,2018-01-07T14:27:00Z
2944,CLOSED,Writing and reading known categorical to parquet results in forgetting categories,,2021-01-12T19:02:27Z
2942,CLOSED,Add float_power,array,2017-12-06T15:49:55Z
2941,OPEN,Dataframe.concat generating large numbers of tasks with overlapping time indexed dataframes,dataframe,2022-11-23T17:03:48Z
2939,OPEN,Add mgrid/ogrid,array, good second issue,2021-10-12T03:03:52Z
2936,CLOSED,to_parquet default output filesize,,2017-11-29T23:37:01Z
2934,CLOSED,Merge b/w two dask data-frame giving MemoryError,,2017-11-29T22:54:00Z
2933,OPEN,Configuring specific token hashing algorithm,,2018-10-29T19:30:38Z
2932,CLOSED,dask.concat seems to change a DateTimeIndex dataframe in a way incompatible with fastparquet,dataframe,2017-12-12T19:43:56Z
2931,CLOSED,dask dataframe groupby apply returns unexpected column order,,2017-11-29T15:02:42Z
2930,OPEN,DOC: from_array's use of tokenize,array, documentation,2021-09-13T21:18:38Z
2929,CLOSED,groupby().apply().reset_index(drop = False) not working when reset_index(drop = True) does work,dataframe,2019-09-12T20:23:20Z
2928,CLOSED,Dataframe.read_sql_table() fails when reading empty table,dataframe,2018-01-24T21:31:13Z
2927,CLOSED,Missing dask.Series.rename(),dataframe,2018-01-03T20:24:38Z
2926,CLOSED,Handle "axis" keyword in DataFrame.rename, DataFrame.reindex,dataframe,2020-11-02T12:42:17Z
2925,CLOSED,Very slow construction of dask.delayed DAG involving metaclass usage,,2017-11-23T16:57:05Z
2923,OPEN,Dask dataframe filesystem committers,dataframe, io,2021-10-12T03:04:27Z
2922,CLOSED,dask dataframe.read_csv,dataframe,2018-10-24T14:24:05Z
2921,CLOSED,dataframe integration with fastparquet not working,dataframe,2017-11-27T15:33:31Z
2920,CLOSED,to_parquet documentation typo?,,2017-11-21T21:25:11Z
2918,CLOSED,Implemention of np.gradient,array,2018-04-25T20:19:53Z
2916,CLOSED,Add invert,good first issue, array,2018-10-24T19:41:56Z
2915,CLOSED,dask.dataframe.corr() doesn't seem to be working well with booleans,,2017-11-21T15:33:23Z
2914,CLOSED,dask dataframe two columns running over each other,,2017-11-20T14:14:20Z
2913,OPEN,Dask array arithmetic should defer to unrecognized classes,array,2017-11-22T20:21:51Z
2912,OPEN,dask.array.asarray should recognize dask duck-types,array,2018-03-31T00:08:37Z
2911,OPEN,Checklist of NumPy functions in Dask Array,array,2022-05-05T18:21:53Z
2907,CLOSED,dask dataframe to_parquet method with engine=pyarrow fails trying to write metadata,,2017-11-21T22:09:11Z
2905,CLOSED,Distributed operations on DataFrame read using engine='arrow' fail with axis 'Length mismatch',dataframe,2018-10-24T14:22:15Z
2901,CLOSED,Update parquet metadata handling for changes in pyarrow 0.8.0,,2017-12-20T21:19:28Z
2900,OPEN,More expressive error message for read_sql_table (when partition is empty),dataframe,2021-10-12T03:06:04Z
2899,CLOSED,More flexible tree reduction for dask.array,array,2017-12-12T05:10:22Z
2896,CLOSED,Fastparquet coverage,,2017-11-17T20:42:21Z
2895,CLOSED,Slow performance adding to a large Dask-graph,,2018-10-24T14:21:00Z
2893,OPEN,Groupby with a tuple key for the grouper,dataframe,2017-11-14T20:31:47Z
2890,CLOSED,Documenting reduction module,,2017-12-13T05:15:47Z
2888,CLOSED,can't concatenate dask series of dataframes into one data frame,,2017-11-14T15:58:44Z
2887,CLOSED,DataFrame.groupby level param,dataframe,2018-10-24T14:18:45Z
2885,CLOSED,`dask.bytes.core.get_fs_paths_myopen` should strip protocol/options from paths,,2018-01-18T20:48:33Z
2884,CLOSED,Bag.to_dataframe fails if bag is empty and meta not specified.,,2017-12-23T18:14:37Z
2883,OPEN,Explicitly handle array indexing types in dask.array.from_array,array,2017-11-18T23:44:01Z
2882,OPEN,Outer indexing support,array,2017-11-18T23:44:11Z
2880,CLOSED,Standardize filesystem interface between dask and arrow,dataframe, io, parquet,2022-03-24T19:16:39Z
2879,CLOSED,Streaming tasks with from_sequence not working,,2017-11-10T19:17:55Z
2878,CLOSED,Is there an approach to resample after groupby?,,2017-11-10T12:38:27Z
2877,CLOSED,Cant use dask.dataframe concat to constuct a dataframe from groupby apply results,,2017-11-10T07:23:30Z
2876,CLOSED,dask.distributed.progress does not work in jupyter notebook,,2017-11-10T14:52:32Z
2874,CLOSED,get_dummies web docummentation is missing,good first issue,2019-07-02T00:36:34Z
2872,CLOSED,dask apply in a loop, running over all the previews columns created each iteration,,2017-11-09T12:42:00Z
2869,CLOSED,ResourceProfiler keeps running after `__exit__`,,2017-11-08T20:19:11Z
2866,CLOSED,Dask hangs in random moment, hard to reproduce,,2020-12-23T01:47:24Z
2865,CLOSED,Implementing axis keyword for topk for dask.array,array,2017-12-12T05:10:27Z
2864,CLOSED,Effect of concatenate on chunk sizes,,2017-11-04T14:28:49Z
2861,CLOSED,test_set_index_on_empty failing on Python 3.4 and NumPy 1.10's CI,,2017-11-03T18:01:06Z
2860,CLOSED,Dynamically change task priorities,scheduler,2018-02-12T19:14:08Z
2859,CLOSED,argtopk for dask arrays,array,2017-12-12T05:14:20Z
2852,CLOSED,Read hive table (parquet) with sentry,,2018-10-24T16:28:18Z
2851,OPEN,Using tree reductions with unique,array,2018-10-18T19:50:03Z
2849,CLOSED,da.linalg.svd_compressed promotes float32 to float64,array,2020-11-18T18:57:05Z
2845,CLOSED,Incorrect parsing/coercing of invalid timestamps,,2017-11-07T01:14:54Z
2843,CLOSED,dask.diagnostics.visualize incompatible with bokeh 0.12.10 (latest),,2017-10-31T03:55:01Z
2841,CLOSED,dask.bag.read_text does not read binary when encoding=None,,2017-10-30T16:44:32Z
2840,OPEN,Unexpected sort on binop between Dask.dataframe and pandas.Series,dataframe,2017-10-29T23:14:59Z
2839,CLOSED,ddf read using read_csv report incorrect partition data,dataframe, io,2021-10-19T13:58:43Z
