6189,CLOSED,pytest fails on windows without pyarrow,,2020-05-11T13:38:23Z
6187,CLOSED,Test Failure Due to Missing Parquet Libraries in Fresh Development Install,,2020-05-09T16:20:40Z
6184,CLOSED,Repartition Dask bags: KeyError: 'bag-from-delayed-convert',,2020-09-11T15:25:39Z
6183,CLOSED,merge_asof(..., left_on='a', right_index=True),dataframe,2020-05-18T15:28:03Z
6181,CLOSED,Visualize not working, when writing to csv file,,2020-05-08T19:28:45Z
6180,CLOSED,Dask groupby count & standard deviation gives incorrect result after datetime to date conversion,dataframe,2020-05-12T00:45:06Z
6177,CLOSED,Allow da.stack to operate on unknown chunk sizes,good first issue, array,2020-05-11T16:14:43Z
6175,CLOSED,Optionally disable warning when concatenating dataframes with unknown divisions,good first issue, dataframe,2020-05-15T19:05:43Z
6174,CLOSED,Make use of Arrow Dataset API for dask.dataframe parquet reader?,,2020-12-01T19:07:01Z
6171,CLOSED,Groupby period does not work,,2020-05-18T13:18:54Z
6170,CLOSED,Array reduction name is not graph-key name,array,2020-05-06T17:41:03Z
6169,CLOSED,da.compress fails when using cupy for condition array,array,2021-02-22T17:51:36Z
6168,CLOSED,Dask crashes with certain masked arrays,,2020-05-29T14:29:55Z
6167,CLOSED,2-step dask DataFrame groupby weirdness,dataframe,2021-09-04T19:16:47Z
6164,OPEN,Distributed Partd,,2021-07-17T18:59:20Z
6163,OPEN,[DISCUSS] Improve client/scheduler performance during shuffling,dataframe, scheduler, discussion,2021-10-13T05:45:53Z
6162,CLOSED,overlap.overlap fails with CuPy backed array and constant boundary,array,2021-02-15T16:14:04Z
6161,OPEN,Support nlargest groupby aggregation,dataframe, good second issue,2020-09-23T19:19:08Z
6152,CLOSED,Forgiving dtypes on dataframe read_json,dataframe, io,2020-06-22T20:54:34Z
6151,CLOSED,Dask interaction with pandas,,2020-08-11T12:28:00Z
6150,OPEN,Feature Request: support using bottleneck nan* functions,array,2020-04-30T21:10:09Z
6148,CLOSED,Upstream dev failures,core,2021-02-04T23:10:18Z
6145,CLOSED,Dataframe drops rows after set index,dataframe,2020-09-11T15:26:07Z
6142,CLOSED,DataFrame.merge raises with AttributeError,dataframe,2020-10-29T18:55:49Z
6141,CLOSED,Issue with dashboard when using DASK with `--dashboard-prefix` with Python3.7,,2020-04-28T00:15:32Z
6139,CLOSED,argwhere tests fail with NumPy 1.18.3,array, core,2020-05-19T02:21:52Z
6136,CLOSED,`dask-schema.yaml` is not in PyPI source,,2020-04-27T13:30:29Z
6135,CLOSED,DataFrame Groupby on Categorical Column + .apply() returns extra rows,dataframe,2020-05-26T18:35:51Z
6134,CLOSED,DataFrame has incorrect dtype after .compute() when group by categorical column,good first issue, dataframe,2020-10-29T18:55:49Z
6133,CLOSED,[DISCUSSION] Column-based "repartitioning"/shuffling API in dask.dataframe,dataframe, discussion,2020-05-29T03:14:45Z
6131,CLOSED,Broken Docs,,2020-04-24T13:39:31Z
6128,OPEN,optimize() and compute() kwargs aren't passed to optimization functions,,2020-04-23T18:49:34Z
6127,OPEN,un-numpy like behavior of `da.pad`,array,2020-05-20T13:26:22Z
6126,CLOSED,convert code python multiprocessing into dask.multiprocessing ( The issue is that pool is not working error in dask multiprocessing),,2020-04-30T21:14:23Z
6125,CLOSED,doc: update the azure section?,io, documentation,2020-05-29T15:07:59Z
6123,OPEN,Compile Blockwise array sub graphs,array, highlevelgraph,2021-10-13T04:05:40Z
6121,CLOSED,bytes_per_chunk doesn't work in read_sql_table,dataframe, io,2021-03-12T14:25:11Z
6120,CLOSED,Dask slow to connect to workers,,2020-05-04T15:32:02Z
6118,CLOSED,dask.fft does not work with cupy arrays,array,2020-12-15T16:24:34Z
6117,CLOSED,dask.pad does not work with cupy arrays,array,2021-02-22T16:03:41Z
6110,CLOSED,len(ddf) produces "RecursionError: maximum recursion depth exceeded" (v2.14.0),dataframe,2020-04-17T18:33:16Z
6109,CLOSED,Unable to start dashboard on ARM processor (Raspberry Pi).,,2020-07-06T18:05:04Z
6108,CLOSED,Dask pivot_table requires much more memory than pandas pivot_table,dataframe, needs info,2021-03-13T20:37:30Z
6107,CLOSED,Expected behavior of dask.array.full() for non-scalar fill values?,good first issue, array,2020-06-02T13:21:16Z
6106,CLOSED,Merge results depend on order of pandas conversion,,2020-04-17T17:35:33Z
6105,CLOSED,nanstd warnings with chunks,array,2020-09-30T15:34:10Z
6104,OPEN,groupby apply using Grouper,dataframe, good second issue,2021-07-15T21:07:42Z
6102,CLOSED,Issue with trim_excess in dask.array.coarsen,,2020-08-30T23:37:54Z
6101,CLOSED,Reusing dask with small datasets,,2020-04-24T18:18:14Z
6100,CLOSED,Reusing dask with small datasets,,2020-04-15T18:52:33Z
6099,CLOSED,to_parquet creating files not glob-able by read_parquet,dataframe, io,2021-03-12T14:35:51Z
6098,CLOSED,set_index on string data,,2021-03-12T18:04:47Z
6097,CLOSED,Convert yyyymmdd to datetime,,2020-04-15T13:38:37Z
6096,CLOSED,add other to_parquet examples,dataframe, documentation,2020-05-12T17:02:11Z
6095,CLOSED,Specify a set of Dask workers to use for a specific process.,,2020-04-22T18:58:55Z
6093,CLOSED,segfault in parquet tests on Windows,tests,2020-04-15T14:18:29Z
6092,CLOSED,read_csv manipulates file path whereas pandas does not,,2020-04-30T21:25:22Z
6089,CLOSED,Error when using a Numpy boolean mask on a Dask array,array,2020-06-02T15:59:15Z
6088,CLOSED,Can't find (and can't install) 'tlz' module,,2020-04-13T16:54:29Z
6086,CLOSED,@pytest.mark.slow is "Unknown",,2020-04-20T09:34:59Z
6085,CLOSED,DataFrames with nullable integer or new string dtype don't support the full roundtrip to parquet,,2020-04-21T18:47:35Z
6083,OPEN,Configure Optimization Pipeline,core,2021-10-13T04:08:19Z
6082,CLOSED,IO for genomic file formats,,2021-03-12T14:44:28Z
6081,CLOSED,creating dask graph distributed.protocol.core - CRITICAL - Failed to deserialize,,2021-03-12T14:45:22Z
6079,CLOSED,Strange error of `dropna` (Until 9 columns allowed for subset parameter).,dataframe,2020-04-10T14:28:01Z
6078,CLOSED,Failing to convert string timestamp to datetime64['s'] using map_partitions,,2020-04-08T17:35:23Z
6076,CLOSED,ValueError in np.repeat(Array) with repeats=0,array,2020-04-09T19:38:03Z
6075,CLOSED,Groupby with multiple columns to parquet raise index related error.,dataframe, io,2020-04-09T20:54:23Z
6074,CLOSED,value_counts groupby multiple keys, wrong index,dataframe,2023-02-01T22:03:38Z
6071,CLOSED,Array flag inconsistencies,good first issue, array,2021-03-12T15:21:26Z
6070,OPEN,Groupby followed by another groupby raising error,dataframe,2021-03-12T14:59:26Z
6068,OPEN,Dask apply throwing error using right meta,dataframe,2021-02-26T07:58:02Z
6067,CLOSED,Please implement numpy.select(),good first issue, array,2021-06-11T15:15:08Z
6062,CLOSED,[Bug] to_csv fails to create directory,dataframe, io,2020-04-07T18:19:43Z
6060,CLOSED,Delayed objects of unspecified length are not iterable,delayed,2020-05-20T19:50:31Z
6058,OPEN,Feature request: dask.dataframe.to_xarray(),dataframe,2021-03-12T15:04:53Z
6055,CLOSED,Can start with terminal, not within PyCharm,,2020-04-01T15:21:49Z
6054,CLOSED,[FEA] Task Graph Annotation,,2020-12-18T13:45:58Z
6050,CLOSED,TypeError: 'float' object cannot be interpreted as an integer,needs info,2021-03-12T15:06:34Z
6049,CLOSED,Uncaught C++ exception while loading parquet saved with different decimal types,,2021-03-12T15:07:59Z
6048,CLOSED,dask.array.linalg.svd signature is different from numpy.linalg.svd,,2020-03-31T22:08:10Z
6046,CLOSED,Issue when reading remote CSV,,2020-04-01T12:23:43Z
6044,CLOSED,shutting down cluster running on baremetal k8s does not delete the service,,2020-03-30T16:42:50Z
6041,CLOSED,dask.array.random docs not showing up properly,documentation,2020-04-08T19:28:14Z
6039,CLOSED,Groupby apply is not working as expected on Dask data frame,dataframe,2021-03-12T15:08:53Z
6037,CLOSED,Getting `concurrent.futures._base.CancelledError` causing unexpected behavior in `from_delayed()`,needs info, delayed,2021-10-19T16:04:07Z
6036,CLOSED,from_array / from_delayed etc. with name can cause unexpected side-effects,,2020-03-27T15:22:04Z
6035,CLOSED,Dependency: Limit Bokeh to < 2.0?,,2020-03-25T19:26:38Z
6034,CLOSED,cuDF reductions on the same groups,,2020-05-11T18:00:20Z
6033,CLOSED,[Feature Request] AWS Batch multi node deployment,,2020-03-22T17:15:14Z
6031,CLOSED,Warning while Label Encoding,,2020-03-26T19:33:43Z
6029,CLOSED,dask.array API to be updated to reflect CuPy and not NumPy's API when using CuPy backed arrays,,2020-03-21T00:17:56Z
6028,CLOSED,Warning about auto_mkdir,,2020-04-02T19:56:50Z
6026,CLOSED,Question/Feature Request/PR offer - passing **kwargs to compute() within to_parquet(),,2020-05-04T23:08:07Z
6021,CLOSED,[DOCS] Styling issue on scheduler-overview,good first issue, documentation,2020-03-21T16:00:24Z
6020,CLOSED,set_index fails for high valued int64 columns without explicit divisions,,2021-03-19T13:37:56Z
6018,OPEN,Merging fails when merging on a column of extension dtype of the same size (Int32 and int32),dataframe,2023-04-05T08:25:33Z
6016,CLOSED,Shape changes when element wise addition,,2020-03-23T09:03:16Z
6015,CLOSED,Understanding the logic behind the dask graph,,2020-03-25T16:58:16Z
6014,CLOSED,Errors with datetime (.dt) methods(dt.hour, dt.minute, etc) on a date-time like column,,2020-03-23T00:10:41Z
6012,OPEN,Issue while reading a parquet file with different data types like decimal using Dask read parquet,dataframe, io, good second issue, parquet,2021-10-13T04:53:53Z
6010,CLOSED,read_sql_query() fails when using nullable integer dtype,dataframe,2020-03-12T16:17:49Z
6009,CLOSED,Dask Broadcast Outer Product Error,array, documentation, needs info,2021-04-10T17:21:17Z
6008,CLOSED,dask.dataframe.pivot_table does not work with multiple values,dataframe,2022-02-28T20:32:03Z
6007,CLOSED,Pickle version mismatch,,2021-03-11T16:59:45Z
6005,CLOSED,TypeError: url type not understood: ..Unable to read json file objects keys from aws s3 ; . using dask,,2020-03-23T00:15:39Z
6004,CLOSED,feature request: add a compute argument to to_hdf5,array,2020-03-25T16:54:32Z
6003,CLOSED,How to test functions on dask graph?,,2020-03-12T19:04:59Z
6001,CLOSED,Feature Request: Support for deltalake,,2020-03-11T14:25:12Z
5999,CLOSED,Long sequence of mapped functions result in non-persistable state,bag,2020-04-07T17:16:57Z
5998,CLOSED,Dask array repr raises error when name is non-zero int,good first issue,2020-03-13T02:06:37Z
5995,CLOSED,to_graphviz overwriting argument and weird behavior,,2020-03-20T13:44:07Z
5994,CLOSED,dask is slow compared to normal pandas while applying custom functions,,2020-03-09T13:00:51Z
5993,OPEN,RandomForests Performance Bug,,2021-03-19T14:07:03Z
5992,CLOSED,Kernel CUDA_ERROR_ILLEGAL_ADDRESS, depending on whether a print statement is executed in da.map_blocks(),,2020-12-09T16:12:57Z
5991,CLOSED,Question on asynchronous operation,,2020-04-02T16:30:49Z
5989,CLOSED,Sequential calls of client.get result in the same delayed object from the cluster,,2020-03-10T12:24:19Z
5988,CLOSED,read_sql_table - lower case columns,,2020-03-11T14:08:16Z
5987,CLOSED,[BUG] dask data frame column renaming,,2020-03-06T16:24:02Z
5986,OPEN,[Feature request] aggregate syntax and quantile computation,dataframe,2021-07-19T15:10:10Z
5985,OPEN,Array fully loaded into memory when trying to store into a memmap array,array, needs info,2022-06-19T19:07:20Z
5982,CLOSED,grouped apply and transform w/ an agg seems to be inconsistent with docs,good first issue, dataframe, documentation,2022-05-30T18:06:21Z
5974,CLOSED,ENH: Add rolling function for groupby objects,dataframe, good second issue,2021-11-03T14:08:33Z
5972,CLOSED,CI failures from leaked subprocesses,tests,2020-03-05T22:25:25Z
5970,CLOSED,Avoid use of deprecated to_task_dask in make_blockwise_graph,,2020-08-16T15:24:18Z
5969,CLOSED,Converting structured array to dataframe within bag results in heavy performance loss,,2020-03-03T20:03:18Z
5968,CLOSED,Datatypes are not casted in concatenation of dataframe.,,2020-03-23T21:15:54Z
5967,CLOSED,Dask loses filesystem protocol name in distributed setting,,2021-03-19T14:25:15Z
5966,CLOSED,Read_parquet ignores chunksize,,2023-03-10T04:58:19Z
5965,OPEN,[DOCS] Flowcharts for intro docs,documentation,2021-10-13T04:46:19Z
5964,CLOSED,dask.dataframe concat function leads to dumped core,,2021-03-12T16:28:55Z
5960,CLOSED,confusing ValueError on dd.get_dummies or dask-ml OneHotEncoder,needs info,2021-08-20T14:39:51Z
5959,CLOSED,BUG: Filtering on columns in read_parquet with partitioned datasets working incorrectly,,2020-03-27T17:41:30Z
5957,OPEN,Dask Orc Files - Mismatched Schema Feature Request,dataframe, io,2021-10-13T02:39:59Z
5956,CLOSED,asyncio\tasks.py:623> exception=RuntimeError,,2020-02-27T21:08:30Z
5955,OPEN,Implement sparse lsqr,array,2021-10-13T04:49:29Z
5953,OPEN,Allow explicit chunk size for `to_zarr`,array, io,2021-03-12T16:21:33Z
5952,CLOSED,Per-partition information in dask.dataframe.DataFrame.memory_usage,,2020-03-04T21:53:24Z
5951,CLOSED,Using dask-distributed for fitting random forest estimator from sklearn,needs info,2021-03-12T16:20:44Z
5950,CLOSED,[FEA] Allow shallow or deep copies of dask dataframes,good first issue, dataframe,2021-08-31T13:59:41Z
5945,CLOSED,execute() got an unexpected keyword argument 'broadcast',,2020-03-04T12:45:20Z
5944,CLOSED,Idea: Alias `.compute()` to e.g. `.c`,,2020-02-26T09:20:59Z
5943,CLOSED,Shared upstream create node in dask.array.to_zarr causes huge memory increase,array, io,2021-06-11T15:59:31Z
5942,OPEN,Writing inplace a modified zarr array with dask failed,array, io,2022-07-01T08:15:17Z
5941,CLOSED,[Bug] Dask 2.10.1 cannot connect to server workers but 2.1.0 can,,2020-03-03T18:16:03Z
5936,CLOSED,Pipe API,,2020-02-24T06:32:20Z
5935,CLOSED,add worker to localcluster,,2020-04-01T22:43:54Z
5934,CLOSED,dd.read_hdf fails with pandas >= 0.24.0,,2020-05-27T19:24:48Z
5932,CLOSED,test_filenames_and_formats appears flaky,,2020-02-21T23:11:42Z
5925,CLOSED,Visualize output in optimization docs doesn't display function names.,documentation,2020-03-10T16:09:43Z
5924,CLOSED,CI: Unpin msgpack,,2020-02-24T13:33:11Z
5921,CLOSED,Rename test_inner,,2020-02-19T03:00:53Z
5919,CLOSED,value_counts() not showing the actual counts,,2020-02-18T19:24:40Z
5918,OPEN,Discussion: making slicing scale better,array,2021-03-20T17:00:51Z
5915,OPEN,MemoryError with `dask.array.from_tiledb`,array, io,2021-03-12T14:51:35Z
5914,OPEN,Intermittent CI failure in test_rolling_methods,dataframe, tests,2021-03-12T14:50:05Z
5913,OPEN,performance indexing stacked array,array, core,2022-10-18T18:54:01Z
5911,CLOSED,Creating a dask masked array from multiple numpy masked arrays,,2020-02-24T14:56:33Z
5910,CLOSED,Intermittent CI failure in test_cov,tests,2021-03-12T14:41:11Z
5908,CLOSED,plan_rechunk sometimes adds a no-op step,,2020-02-17T15:43:39Z
5906,CLOSED,Issue when creating a single dask array from multiple files,,2020-02-17T16:09:39Z
5904,CLOSED,dask.core.quote does not quote dicts,,2020-02-17T15:36:41Z
5902,CLOSED,Support for explicit dtype in da.coarson,,2020-02-16T17:01:11Z
5899,CLOSED,Feature Request: Fast alternative to from_array,,2021-03-12T14:39:59Z
5897,CLOSED,normalize_token pickles data of literal,,2020-02-16T17:01:42Z
5894,CLOSED,exception derived from BaseException causes KilledWorker exception in gather(),,2020-04-30T13:22:05Z
5893,CLOSED,KeyError with set_index(col, npartitions="auto") when reading parquet,,2020-03-05T13:57:47Z
5887,CLOSED,WinError 193 when trying to read parquet file from remote HDFS,,2020-02-18T05:56:57Z
5886,CLOSED,Unclear error message when meta column order does not match,dataframe,2020-02-19T21:34:51Z
5885,CLOSED,LocalCluster Asynchronous=True potential bug?,,2020-02-27T15:17:12Z
5881,CLOSED,Lobby AWS for a serverless Glue option to run dask clusters,,2020-02-16T17:49:50Z
5879,CLOSED,Putting lazy collections into Dask Arrays,,2020-02-10T15:40:37Z
5875,CLOSED,dask.dataframe import problem,,2020-02-10T11:59:56Z
5873,CLOSED,dataframe.to_parquet method always appends data when partitioned,io, core,2021-03-12T14:39:03Z
5870,CLOSED,Submitting task to remote scheduler,,2020-02-11T16:28:22Z
5869,CLOSED,Losing index information when using dask.dataframe.to_parquet() with partitioning,,2020-02-06T16:01:27Z
5868,CLOSED,Killed Worker on Pangeo Cloud,,2020-02-06T13:08:47Z
5867,CLOSED,Flaky test test_rearrange,tests,2020-03-31T19:34:28Z
5865,OPEN,Require fastparquet>=0.3.3,dataframe, core, parquet,2021-10-13T03:13:32Z
5864,CLOSED,Memory leak on local cluster,,2020-04-30T13:51:18Z
5863,CLOSED,dask dataframe - collect list example,dataframe, documentation,2020-02-24T05:52:59Z
5859,CLOSED,Ordering changes negatively affecting memory use,,2020-05-11T14:12:08Z
5858,CLOSED,FeatureRequest: read_sql_table in ThreadPool,,2020-02-11T16:21:04Z
5857,CLOSED,pip command line warning,good first issue,2020-02-04T20:25:19Z
5856,CLOSED,Issue reading Parquet via Impala,dataframe, io, needs info, parquet,2021-11-02T14:15:46Z
5854,CLOSED,dropna() is not working propertly,,2023-03-17T15:10:18Z
5853,CLOSED,Error when tokenizing pandas objects if dask[dataframe] not installed,dataframe,2020-01-31T15:44:22Z
5850,CLOSED,Dask array with non-highlevelgraph leads to KeyError,,2020-02-14T19:46:08Z
5849,CLOSED,pip install dask==2.9.2 installs distributed 2.10.0,,2020-01-30T15:24:49Z
5848,CLOSED,str.extract StringDtype works with pandas 1.0.0rc0 but fails with pandas 1.0.0 final (TypeError),,2020-01-30T16:25:19Z
5847,OPEN,DataFrame: incorrect agg results with sparse values with categorical index and npartitions > 1,dataframe,2020-02-07T14:05:31Z
5846,CLOSED,KeyError: 'index' when appending to an existing DataFrame,dataframe,2020-01-31T03:08:24Z
5845,CLOSED,DataFrame.head() with boolean subsetting gives incorrect results,dataframe,2020-02-04T19:49:09Z
5843,CLOSED,Naive implementation for divisions when reading sql,io,2020-02-18T04:19:54Z
5842,CLOSED,`_metadata` is re-read for every partition when using `fastparquet` engine,io, parquet,2021-10-13T17:23:14Z
5840,CLOSED,Dask worker - kubernetes,,2020-02-05T12:20:40Z
5839,CLOSED,tuple index out of range error when assign a dask array to a dask DataFrame column,dataframe,2022-07-26T18:53:17Z
5838,CLOSED,Dask Groupby does not generate correct sum results for grouping variables that are pd.Categorical,dataframe,2020-02-07T14:08:43Z
5837,OPEN,Individual aggregations work, multiple fail,dataframe,2020-05-01T17:28:47Z
5834,OPEN,[FEA] Support for as_index in groupby,dataframe,2020-12-19T13:31:25Z
5833,CLOSED,Support StringDtype in `str.extract` (and probably elsewhere),,2020-01-30T13:14:41Z
5832,CLOSED,AssertionError creating array with StringDtype instead of StringDtype(), can we have a friendlier error message?,,2020-01-27T17:12:13Z
5831,CLOSED,How can Dask acknowledge developer contributions by companies?,,2020-01-27T15:52:05Z
5830,CLOSED,dataframe date comparison,dataframe,2020-02-07T14:12:36Z
5829,CLOSED,Deprecation warning over invalid escape sequences,,2020-02-07T14:23:06Z
5824,CLOSED,map_overlap graph has floating point keys,array,2021-07-22T21:05:26Z
5823,OPEN,Parse environmental variables in configuration yaml file,config,2020-01-29T22:22:40Z
5822,OPEN,Set Directory Permissions with to_parquet,dataframe, io, parquet,2021-10-13T03:24:23Z
5820,CLOSED,GroupBy-Aggregate on multiple categorical columns fails with MemoryError due to pre-allocating full Cartesian product of categories,,2020-01-22T14:35:25Z
5819,CLOSED,Dask dataframe `read_csv` does not expand user home directory ("~") in path.,dataframe, io,2020-01-30T15:17:59Z
5818,CLOSED,KilledWorker error when accessing S3 (again),,2020-02-14T02:34:59Z
5817,CLOSED,ModuleNotFoundError: No module named 'numba',,2020-02-04T18:19:06Z
5814,CLOSED,to_parquet(.., compute=False) returns optimized graph,,2020-01-29T10:56:28Z
5811,CLOSED,Is dask.linalg.svd_compressed basically the same as sklearn.utils.extmath.randomized_svd,,2020-01-22T01:45:40Z
5810,CLOSED,Feature request: including filenames in dask bags,,2020-02-07T14:23:56Z
5809,OPEN,[FEA] Dask graph optimization pass for dropping columns during multi-merge workflows,dataframe, scheduler,2020-09-17T14:24:30Z
5808,CLOSED,Undocumented DataFrame set_index argument: partition_size,,2020-01-21T16:16:09Z
5806,CLOSED,Unclean multiprocessing.Pool teardown on Python 3.8,,2020-02-03T18:01:16Z
5805,CLOSED,dask.dataframe.read_csv can't access file on network server,,2020-01-20T04:29:24Z
5803,CLOSED,Support for Dask executor in Apache Airflow,,2020-05-12T22:42:26Z
5802,CLOSED,Dataframe operations not working on empty dataframes,dataframe,2020-02-06T13:19:20Z
5795,CLOSED,map_blocks multi-argument behavior,array,2020-02-07T15:12:30Z
5793,CLOSED,Why Dask Page has missing images,,2020-01-23T23:05:05Z
5790,CLOSED,Complex conjugate with cupy generates errors,,2020-01-21T16:17:34Z
5788,CLOSED,Adjust DataFrame repr for pandas 1.0,,2020-02-07T14:25:02Z
5787,CLOSED,Fix CSV encoding with pandas 1.0,dataframe,2024-03-04T12:01:49Z
5785,CLOSED,Sending dask dataframe to elasticsearch,,2020-01-18T07:38:03Z
5780,OPEN,Feature Request: Export performance reports in machine readable format,,2020-01-21T16:19:06Z
5778,CLOSED,workers die at 50% memory usage when calling persist(),,2020-01-14T20:11:04Z
5775,CLOSED,[BUG] Mean groupby aggregation fails with Pandas>25.0,,2020-01-08T21:29:28Z
5774,CLOSED,dask.dataframe.read_parquet fails unless written by fastparquet,,2020-01-14T19:31:20Z
5773,CLOSED,dask.dataframe.read_parquet producing empty columns for those partitioned on,,2020-01-13T16:16:09Z
5770,CLOSED,tokenize performance,,2020-01-09T20:48:53Z
5769,OPEN,Retaining chunking when reading HDF files (on cloud storage),array, io,2021-10-13T03:27:58Z
5768,CLOSED,Bug report: Dask submit and gather of 2D array objects is unacceptably slow,,2020-01-10T15:49:14Z
5763,CLOSED,Writing stacked delayed dask arrays raises exception,,2020-01-04T18:34:36Z
5762,CLOSED,GroupBy `std` aggregation raises `ValueError`,,2020-01-17T02:21:20Z
5761,CLOSED,Possible bug when checking an empty dataframe,good first issue, dataframe,2020-01-14T20:23:45Z
5759,CLOSED,Dask Dataframe doesn't read parquet metadata file/fails for multiple partitions,,2020-02-03T20:42:00Z
5758,CLOSED,Reading from remote HDFS requires local libhdfs/arrow installation,io,2022-03-25T18:04:12Z
5756,OPEN,`clear_known_categories` overrides categories.dtype for non-object dtypes,dataframe,2021-10-13T03:29:52Z
5755,CLOSED,set_index() on list with one item,,2020-01-04T16:15:21Z
5754,CLOSED,numpy.broadcast_array on dask array raises ValueError("Chunks do not align").,,2020-01-15T18:54:49Z
5753,CLOSED,If/else Regex in dask dataframe (str.contains) not working,,2020-01-14T19:40:38Z
5752,CLOSED,Dask.read_parquet fails - distributed.protocol.pickle - INFO - Failed to deserialize,,2019-12-30T16:23:20Z
5751,CLOSED,dask.compute didn't work as expected,,2019-12-27T16:44:41Z
5749,CLOSED,helm config environment in docs is out of date,,2019-12-27T16:39:30Z
5748,CLOSED,free(): invalid size,,2019-12-25T13:43:53Z
5746,CLOSED,Bug report: DataFrame resample fails for some timezones,good first issue, dataframe,2020-01-21T14:00:19Z
5745,CLOSED,can't pickle_asyncio.Task objects,,2019-12-23T17:16:40Z
5744,CLOSED,Feature request: DataFrame.mode(),good first issue, dataframe,2020-04-14T16:33:52Z
5742,CLOSED,read_hdf followed by drop_duplicates error,,2020-04-01T22:49:17Z
5739,CLOSED,Use shallow copies when assigning columns,,2020-02-19T17:27:29Z
5738,CLOSED,Feature Request: pull delayed scheduler from configuration,,2020-04-30T15:05:54Z
5732,CLOSED,Crash when trying to use Julia from Dask multiprocessing,needs info,2022-12-12T17:38:22Z
5731,CLOSED,Intermittent failure in Python 3.8 test_temporary directory,tests,2020-04-15T13:57:50Z
5729,OPEN,[FEA] API method for removing empty partitions from a dataframe,dataframe,2020-04-01T23:07:01Z
5726,CLOSED,[BUG] cumulative aggregations fail on dataframes with empty partitions,,2020-01-07T17:56:23Z
5725,CLOSED,std function returns NaN for long floats,,2019-12-19T15:58:18Z
5723,OPEN,Dask read sql table() sometimes not functioning properly for reading DB,io,2021-10-13T03:39:44Z
5722,CLOSED,Read ORC hive tables using Dask read_orc() - missing column names,dataframe, io, needs info,2021-11-22T13:35:06Z
5721,CLOSED,visualize() not outputting anything for Delayed(xarray object),good first issue,2020-05-22T14:43:24Z
5720,CLOSED,DataFrame.set_index fails when column has pandas extension dtype,dataframe,2022-10-18T20:39:33Z
5718,CLOSED,Second Dask DataFrame computation breaks due to sklearn import,,2020-04-01T23:00:00Z
5714,CLOSED,More explicit support for cupy-backed dask.Array,,2019-12-16T18:36:47Z
5712,CLOSED,Function np.average fails on Dask data frame with categorical field,,2019-12-17T15:15:38Z
5707,CLOSED,Fix simple typo: wihout -> without,,2019-12-12T21:25:03Z
5706,CLOSED,bagged numpy array in kwargs raises value error,good first issue, bag,2020-02-04T20:38:05Z
5705,CLOSED,Consider implementing .array and .to_numpy,,2020-03-23T18:23:12Z
5704,CLOSED,Enable compression for on-disk shuffle with PartD,dataframe,2020-01-16T13:45:01Z
5702,OPEN,Merged dataframe complains that not all divisions are known,dataframe,2021-10-13T03:42:55Z
5700,CLOSED,dask.array.block multiplying indicies together resulting in incorrect dimension shape,,2019-12-11T01:08:34Z
5699,CLOSED,[QST] Initiate Communication Task,,2021-10-13T03:44:13Z
5698,CLOSED,Implement dask.dataframe.to_numeric,dataframe,2020-02-27T16:43:34Z
5695,OPEN,Configuration Validation,config,2022-12-08T18:12:08Z
5692,CLOSED,I HAVE THE SAME PROBLEM,,2019-12-11T14:23:01Z
5691,OPEN,Providing URLs to imread,array, io,2019-12-12T15:47:18Z
5689,OPEN,Support byteswap,array,2019-12-16T14:41:39Z
5688,CLOSED,dask mistakenly thinks or tries to invert a boolean as if it is a float.,,2019-12-10T20:08:53Z
5687,CLOSED,Using cloud-volume as a storage backend,,2019-12-17T00:01:46Z
5680,CLOSED,Applying da.std to numpy array yields keyword error,array,2019-12-05T19:16:16Z
5679,CLOSED,da.std and da.var handle complex values incorrectly,array,2023-09-25T15:02:38Z
