8625,CLOSED,Dropped Support for Custom Metadata Types,needs info,2022-02-03T18:18:36Z
8624,CLOSED,AttributeError: 'DataFrame' object has no attribute 'name'; Various stack overflow / github suggested fixes not working,dataframe, documentation,2022-02-17T14:07:41Z
8622,CLOSED,Broken usage of capsys for inspecting logging output,dataframe,2022-08-02T11:06:55Z
8620,OPEN,`read_sql_query` with meta converts dtypes from 32 to 64.,bug, p3,2022-08-17T13:42:49Z
8619,CLOSED,Improve to_parquet "Schemas are inconsistent" error messages,good first issue, dataframe, parquet,2022-05-27T14:42:01Z
8618,CLOSED,Add first and last aggregate functions to `dask.dataframe.pivot_table`,good first issue, dataframe,2022-02-23T18:35:13Z
8616,OPEN,[DISCUSSION] Layer-by-Layer Graph Execution,discussion, highlevelgraph,2022-03-14T01:57:06Z
8615,CLOSED,Pyarrow failures on 3.7 builds,parquet,2022-01-24T17:48:27Z
8613,CLOSED,Outdated code example in dataframe create docs,,2022-01-24T18:54:09Z
8611,CLOSED,regression in a custom groupby.agg when split_out is not None,,2022-02-02T03:21:37Z
8608,CLOSED,MD5 not supported without usedforsecurity=False in FIPS 140-2 environment,,2022-02-28T20:50:40Z
8607,CLOSED,Improve how apply_along_axis deals with the shape",array, needs info,2022-01-26T16:58:15Z
8599,CLOSED,`Series.str` / `Series.dt` methods missing from Docs,dataframe, documentation, needs attention,2022-03-11T17:22:34Z
8598,CLOSED,ValueError of shape mismatch when assigning vector to a slice of matrix,,2022-01-24T18:55:55Z
8596,CLOSED,Add `engine_kwargs` argument to `dask.dataframe.to_sql`,good first issue, dataframe,2022-02-01T16:40:48Z
8586,CLOSED,Aggregrate without summarizing the original dataframe,,2022-01-26T17:05:20Z
8585,OPEN,Make meta publicly accessible,dataframe, discussion, needs attention,2022-03-14T01:57:06Z
8584,CLOSED,`@derived_from` decorator not copying docstring,documentation, good second issue,2022-01-24T22:21:12Z
8583,CLOSED,Add scheduler option to `assert_eq` utilities,good first issue,2022-02-09T13:44:47Z
8582,CLOSED,Indexing 0-D dask array handling raises exceptions,array,2022-01-20T20:22:16Z
8581,OPEN,Blockwise serialization can fail with LocalCluster(processes=False),core, highlevelgraph, needs attention,2022-05-13T20:02:53Z
8580,CLOSED,Failures with upcoming pandas 1.4 release,dataframe, good second issue,2022-01-27T14:36:43Z
8579,OPEN,Type inference failure when column type is np.ndarray,array, needs attention, hygiene,2022-03-14T01:57:07Z
8578,CLOSED,groupBy on index of Series fails,,2022-01-26T19:17:04Z
8577,CLOSED,zarr region support,array, io,2022-02-01T15:43:56Z
8575,CLOSED,Remove `list` tag?,,2022-01-16T03:12:33Z
8574,CLOSED,dask yaml load error: TypeError,,2022-01-14T23:27:22Z
8570,OPEN,Culling massive Blockwise graphs is very slow, not constant-time,highlevelgraph,2022-09-20T22:12:51Z
8569,CLOSED,Cannot join DataFrame on nullable data types (e.g. Int64),,2022-01-14T07:04:02Z
8568,CLOSED,Document `dask.DataFrame.from_delayed` compatibility with `Future`s,good first issue, documentation,2022-01-19T20:36:50Z
8567,OPEN,Show names of layer dependencies in HLG JupyterLab repr,good second issue, highlevelgraph, enhancement,2022-02-25T21:55:06Z
8549,OPEN,OSError: Could not load shared object file: llvmlite.dll,upstream,2022-02-04T15:08:12Z
8547,CLOSED,Unable to replicate random samples between dask and numpy,array, needs info,2023-04-10T21:22:46Z
8546,OPEN,Allow coroutines to be used in dask.bag operations,bag,2022-01-19T20:40:21Z
8543,CLOSED,Set minimum pyyaml version,,2022-01-10T20:31:26Z
8541,CLOSED,Mutually inconsistent `x_chunk` and `axis` argument-values during `dask.array.reduction()`,,2022-02-10T14:20:27Z
8539,CLOSED,Add include_path_column to read_json,dataframe, good second issue,2022-01-31T21:14:53Z
8537,CLOSED,dask apply loses index type with simple meta,,2022-01-24T17:34:13Z
8535,CLOSED,Blockwise optimization bug when collections appear multiple times,array, highlevelgraph,2022-01-14T17:22:40Z
8532,CLOSED,Dask interprets boolean array as an index array,array,2022-01-13T18:49:32Z
8530,OPEN,dask.dataframe.describe error with nullable data types,dataframe, needs attention, p3,2022-03-24T17:50:31Z
8528,OPEN,From Delayed throws exception when column names are out of order,dataframe,2022-01-19T17:11:44Z
8526,CLOSED,Pushing array rechunking into the I/O layer,needs attention,2023-03-22T15:45:30Z
8524,CLOSED,ProgressBar `out` parameter issues,good first issue, documentation,2022-02-01T14:21:39Z
8518,CLOSED,dask.array.percentile: rename interpolation arg to method,,2022-01-05T21:39:46Z
8516,CLOSED,Dask doesn't reload code,,2021-12-23T18:58:36Z
8515,CLOSED,[BUG] read_json doesn't respect to meta,,2021-12-24T06:03:15Z
8513,CLOSED,DataFrame.loc errors when row indexing with list, even with set number of partitions,,2021-12-23T15:54:58Z
8506,OPEN,Failing Windows tests,needs attention,2022-01-24T01:49:10Z
8504,CLOSED,Nightly build failure,,2022-01-04T23:58:05Z
8503,CLOSED,Update DataFrameGroupBy.apply warning,documentation,2022-04-28T13:48:17Z
8500,CLOSED,conftest.py is missing from sdist,,2021-12-20T01:40:51Z
8499,OPEN,test_development_guidelines_matches_ci fails from sdist,needs attention,2022-03-08T17:33:01Z
8497,CLOSED,Show length of layer in HLG JupyterLab repr,good second issue, highlevelgraph,2022-02-18T13:54:48Z
8496,CLOSED,`from_dask_array` materializes the graph unnecessarily,dataframe, array,2022-04-20T00:59:28Z
8495,CLOSED,Different output for to_json(compute=False) and to_json(compute=True),dataframe, needs attention,2022-01-19T18:41:51Z
8493,CLOSED,Dask scheduler high cpu usage when dashboard port is probed,needs info,2022-04-25T00:15:52Z
8491,CLOSED,`require_extension` regression in `read_parquet`,dataframe, io, parquet, needs attention,2022-04-20T20:24:51Z
8485,CLOSED,Add optimize_graph flag to Bag `to_dataframe` function,bag,2022-01-19T20:43:33Z
8482,CLOSED,nanmin & nanmax no longer work for scalar input,,2021-12-15T07:48:35Z
8480,OPEN,`test_scheduler_highlevel_graph_unpack_import` flaky,tests,2022-02-16T20:11:41Z
8475,CLOSED,PyPI sdist tarball is missing 'conftest.py',,2022-05-24T16:01:39Z
8474,OPEN,Cross-scheduler inconsistent result structure,good second issue, core, enhancement,2023-01-10T13:15:43Z
8473,CLOSED,Changelog links don't reference specific release version,good first issue, documentation,2022-01-07T19:51:58Z
8466,CLOSED,Sporadic test collection failure,tests,2021-12-13T20:12:10Z
8465,CLOSED,gpuCI build timeout,,2021-12-10T19:54:18Z
8463,CLOSED,Update Readme file,documentation,2022-04-01T20:27:08Z
8461,CLOSED,Default for dtype not correct for array-like objects,good first issue, array,2022-01-13T18:50:52Z
8460,OPEN,Assignment using 1D dask Array index,array,2022-05-10T16:16:24Z
8458,CLOSED,merge_asof works incorrectly (with reproducible example),dataframe, bug,2022-03-30T15:12:25Z
8450,CLOSED,Chunks/dtype not considered with map_blocks result name,array, needs info,2021-12-07T21:03:08Z
8449,CLOSED,`to_delayed(optimize_graph=False)` has an invalid HighLevelGraph,,2021-12-03T02:00:34Z
8448,OPEN,Add fusion optimization for Delayed,delayed, highlevelgraph,2022-11-16T21:58:35Z
8447,OPEN,Consider reactivating low-level DataFrame optimization when not all layers are Blockwise,dataframe,2021-12-03T02:57:35Z
8446,CLOSED,dask dataframe read_parquet split_row_groups docs outadated?,dataframe, io, documentation, parquet,2021-12-15T19:13:19Z
8445,CLOSED,Suboptimal graph structure when read-writing a parquet,,2022-02-02T22:07:17Z
8444,CLOSED,DASK slow down the IDE,,2021-12-08T20:26:11Z
8454,CLOSED,DOC: note that compute does not optimize delayed objects,needs info, delayed,2021-12-03T23:03:17Z
8443,CLOSED,DOC: add example of to .dask (HighLevelGraph repr) to docs in https://docs.dask.org/en/latest/graphs.html,documentation,2022-02-04T18:00:15Z
8439,CLOSED,Series / DataFrame view method not implemented.,dataframe, good second issue,2022-01-18T21:32:52Z
8438,CLOSED,Avro - s3 byte range for just schema or row count,,2021-12-08T16:34:24Z
8437,OPEN,When `divisions` has repeats, `set_index` puts all data in the last partition instead of balancing it,dataframe,2021-12-01T09:14:44Z
8435,OPEN,[Discussion] Don't compute divisions by default in `set_index`?,dataframe, discussion,2022-03-03T19:41:18Z
8434,CLOSED,Nan values read in as 1.0 when using read_csv,dataframe,2021-12-01T17:31:30Z
8429,CLOSED,Cannot catch and reraise exception with context on .compute(),,2021-11-29T20:04:26Z
8421,OPEN,DataFrame.groupby sorts group keys even with sort=False,dataframe, bug, p3,2022-08-25T17:12:35Z
8420,CLOSED,Feature Request: cache calls to __getitem__ on array-like object,array, needs info,2022-03-01T17:55:15Z
8418,CLOSED,dask dataframe read_csv + filtering fails when using comment kwarg,dataframe, io,2021-12-13T21:04:03Z
8415,OPEN,Documentation for `set_index(col, compute=True)` is unclear/inaccurate,dataframe, documentation,2022-03-01T17:55:55Z
8409,CLOSED,Update install instructions for dask-dev enviornment,documentation,2021-11-22T19:37:21Z
8408,CLOSED,Weird behavior during assertion,,2021-11-22T22:45:00Z
8407,CLOSED,Reading in DataFrame with header=1 causes first column to be inaccessible,dataframe, io,2021-11-29T16:19:00Z
8402,CLOSED,read_csv throws BlockSizeError,dataframe, io,2021-11-19T20:15:56Z
8399,CLOSED,Mismatch between parquet statistics and parts silently drops data,dataframe, needs info, parquet,2022-03-01T18:04:21Z
8395,CLOSED,Add DataFrame.nunique(),dataframe, good second issue,2021-12-22T14:09:22Z
8391,CLOSED,Change default boundary value to "none" for dask map_overlap,array, discussion,2022-03-01T19:56:13Z
8390,CLOSED,`to_parquet` call fails with index of type `int` and data of type list of lists,dataframe, parquet,2022-03-01T21:20:16Z
8388,CLOSED,Standardizing type for `divisions`,dataframe, discussion, needs attention,2021-12-20T21:48:23Z
8387,CLOSED,Issue when indexing small array with a few index values,array, needs info, needs attention,2022-01-12T16:14:17Z
8386,CLOSED,IntCastingNaNError: Cannot convert non-finite values (NA or inf) to integer on non integer column.,bag, dataframe,2023-02-01T23:40:31Z
8382,CLOSED,QST: task count for getting one partition,dataframe, discussion, parquet,2022-03-24T22:40:14Z
8381,CLOSED,Missing conda yml file,,2021-11-15T19:52:12Z
8380,OPEN,da.store loses dependency information,array, bug,2022-12-09T15:38:41Z
8378,CLOSED,dask memory issue, isn't it supposed to handle larger than memory computation?,dataframe, needs info,2021-11-24T16:30:51Z
8377,OPEN,Thoughts on "Getting Started" section,documentation, discussion, needs attention,2021-12-20T01:50:32Z
8376,CLOSED,pure delayed gives wrong result for dataclass methods,core,2022-02-23T01:29:39Z
8374,CLOSED,IndexError when reading empty parquet file with chunksize,good first issue, dataframe, good second issue, parquet,2021-12-15T20:01:44Z
8373,CLOSED,Nullable types saved incorrectly in partitioned parquet files, leading to ValueError when appending,dataframe, io, parquet,2021-12-03T20:49:21Z
8366,CLOSED,Upstream failures,upstream, needs attention,2022-03-25T17:42:53Z
8364,CLOSED,Issues with windows 3.7 and graphviz,upstream,2021-11-22T19:34:05Z
8362,CLOSED,graphviz failures on CI,,2021-11-08T22:41:10Z
8361,OPEN,Optimized groupby aggregations when grouping by a sorted index,dataframe,2022-03-24T16:02:37Z
8360,CLOSED,Delayed optimizations causing breakage in `dask_ml.wrappers.Incremental.fit`,,2021-11-11T21:08:33Z
8359,CLOSED,`set_index` does not support passing in a dask Index,dataframe, enhancement,2022-03-16T16:02:54Z
8357,OPEN,Support Dask Dataframe Transpose,dataframe, good second issue,2022-08-25T17:20:54Z
8355,OPEN,Could not deserialize task when using `npartitions="auto"` in `DataFrame.set_index()`,array, bug,2022-09-14T18:36:06Z
8353,OPEN,ignore_index is not used in dd.concat,dataframe,2022-08-11T03:17:30Z
8352,CLOSED,Empty chunk causes exception in nanmin/nanmax,array,2021-11-22T21:47:54Z
8349,CLOSED,Regression: `read_parquet` fails on main (not on 2021.10.0),parquet,2021-11-05T20:25:54Z
8348,CLOSED,Promote setup documentation in Docs TOC,documentation,2022-01-21T18:50:50Z
8347,CLOSED,`set_index` on a column containing NaN raises confusing error (`partition_quantiles` not robust to NaNs),dataframe, needs attention,2022-05-11T17:40:36Z
8346,CLOSED,`set_index` on a column containing NaN raises confusing error (`partition_quantiles` not robust to NaNs),,2021-11-04T22:21:35Z
8344,CLOSED,Update Talks & Presentation page of docs,documentation,2021-12-04T00:57:42Z
8343,CLOSED,Support Column assignment with more types,,2021-11-04T05:20:24Z
8342,CLOSED,Improve documentation of `block_info` keyword argument in Dask array `map_blocks`,good first issue, array, documentation,2022-03-18T05:50:44Z
8340,OPEN,Dask DataFrame not supported by NumPy functions (NEP-18),dataframe, array, needs attention,2021-12-06T01:48:42Z
8338,CLOSED,`map_partitions` doesn't broadcast single-partition DataFrames,dataframe,2021-11-05T15:19:52Z
8335,CLOSED,`aiobotocore` releated test failures,,2024-03-27T18:40:57Z
8334,OPEN,Use map instead of batch submit in local.get_async,,2021-11-29T10:48:31Z
8333,CLOSED,get_async and chunksize,,2021-11-04T19:39:54Z
8331,CLOSED,Use more explicit keywords,good second issue,2021-12-15T20:17:32Z
8330,CLOSED,`bcolz` no longer maintained,discussion,2022-03-02T17:44:17Z
8329,CLOSED,AttributeError: module 'dask' has no attribute 'array',,2021-11-02T17:28:56Z
8327,CLOSED,empty partition in from_delayed,needs info,2022-03-01T18:31:50Z
8326,OPEN,GitHub action for stale issues/PRs hitting API limit,needs attention,2021-12-06T01:48:43Z
8324,CLOSED,Why is it undesirable for delayed functions to mutate inputs?,discussion,2021-11-08T16:15:14Z
8323,CLOSED,inconsistency in dataframe: no multiindex from pandas, but allowed from parquet,needs attention,2022-03-01T17:47:53Z
8320,CLOSED,read_parquet from HDFS always raise error "list index out of range",needs info, parquet,2021-11-16T23:16:05Z
8319,CLOSED,divisions lost when using index.to_series,dataframe, needs info,2021-11-02T08:15:41Z
8315,CLOSED,Xgboost on K8s does not work,needs info,2021-11-01T11:49:29Z
8313,CLOSED,Even the Cheat Sheet PDF is not available for download,,2021-10-28T12:29:36Z
8309,CLOSED,`partition_info` in `map_partitions` materializes the graph unnecessarily,dataframe, needs attention,2021-12-08T18:24:06Z
8308,OPEN,`map_partitions` only aligns arguments in `*args`; `**kwargs` are concatenated first,dataframe, documentation, good second issue,2022-06-24T14:35:46Z
8307,OPEN,Groupby + split_out fails when key columns have the same name,dataframe, needs attention,2021-12-06T01:48:45Z
8306,CLOSED,Use Blockwise/`map_partitions` in various DataFrame join methods,dataframe, highlevelgraph,2022-03-23T15:55:56Z
8303,CLOSED,Client() causes concurrent.futures._base.CancelledError,needs info,2022-03-01T18:00:06Z
8301,CLOSED,Deprecate AxisError, itemgetter, methodcaller,,2021-10-28T15:13:06Z
8299,CLOSED,CI Issues on main,,2021-10-26T02:34:55Z
8297,CLOSED,Series is_monotonic, is_monotonic_decreasing, is_monotonic_increasing,dataframe, needs attention,2021-12-10T17:39:21Z
8294,OPEN,Shuffle prototype: Feedback (disk usage + workers dying),,2021-11-06T14:03:01Z
8293,CLOSED,Datetime Casting Causes Issues in 1+ Row DataFrame,,2021-10-24T11:21:19Z
8292,OPEN,graph became invalid in 2021.10.0,dataframe, needs attention,2021-12-21T19:03:23Z
8290,CLOSED,Managed per worker loaded large object in distributed worker memories?,needs info,2022-03-03T08:29:00Z
8289,OPEN,#4012 for read_csv?,dataframe, io,2022-03-03T08:30:49Z
8288,CLOSED,Python 3.10 support,,2022-03-31T16:20:43Z
8285,CLOSED,handle_out() returns nothing if out is set,,2021-11-25T16:34:20Z
8284,CLOSED,how to configure dask to use swap space to avoid memory error,needs attention,2022-03-01T18:19:03Z
8280,OPEN,computing std of sparse matrix produces an error,array,2022-03-01T18:22:58Z
8278,CLOSED,How to handle upstream warnings in CI,upstream, needs attention,2022-02-21T22:11:47Z
8271,CLOSED,Increase the usage of augmented assignment statements,,2021-11-21T13:47:33Z
8269,CLOSED,Timezone error in merging Dask and Pandas,dataframe, needs info,2021-11-16T23:16:48Z
8268,CLOSED,Flaky test - test_progress.py::test_register,tests,2021-10-20T13:01:53Z
8265,CLOSED,Can't access histogram2D or DD,array, needs info,2021-10-14T22:38:42Z
8264,CLOSED,Improve documentation of `DataFrame.divisions`,good first issue, dataframe, documentation,2021-11-17T17:02:44Z
8262,OPEN,Use Rich more broadly?,discussion,2021-10-25T03:28:14Z
8260,CLOSED,TypeError: len() of unsized object when converting dask array to tensor,,2021-10-19T17:54:42Z
8255,CLOSED,Nested documentation redirects not working,documentation,2021-10-21T20:53:47Z
8252,CLOSED,`KeyError` in `dask.graph_manipulation.bind`,,2021-10-21T20:47:41Z
8245,OPEN,Implement `unstack()` and/or `pivot()`,dataframe,2022-02-05T16:46:11Z
8243,CLOSED,Deprecate "pyarrow-legacy" engine in dask.dataframe.read_parquet,dataframe, io, parquet, needs attention,2022-04-06T08:11:59Z
8236,CLOSED,API docs misrendering with new sphinx theme,documentation,2021-10-29T14:59:19Z
8233,OPEN,Monthly community meeting,community, needs attention,2022-03-21T19:09:42Z
8230,CLOSED,âš ï¸ Upstream CI failed âš ï¸,,2021-10-07T16:33:20Z
8229,OPEN,Unexpected behaviour with out-of-bound indices,array,2021-10-25T21:41:58Z
8227,CLOSED,ReadTheDocs PR builds are failing,documentation, needs attention,2022-01-07T19:11:19Z
8226,CLOSED,Local Processes scheduler question,,2021-10-06T16:17:32Z
8224,CLOSED,Distributed LocalCluster's `memory_limit` keyword argument needs documentation,good first issue, documentation,2022-08-29T14:55:10Z
8220,CLOSED,`test_cupy_sparse.py` failures on gpuCI build,,2021-10-05T21:25:45Z
8218,OPEN,Possible bug: `dask.array.compute()` hanging with `multiprocessing.Pool`,array, needs attention,2021-11-15T01:46:41Z
8217,CLOSED,ImportError: cannot import name 'apply' from 'dask.compatibility',,2021-10-05T13:20:58Z
8216,OPEN,Pandas 1.2.0 compatibility - column reductions are applied column-wise (when possible),dataframe, needs attention,2022-02-23T15:13:23Z
8214,CLOSED,Pandas 1.2.0 compatibility - `std()` for the `datetime64[ns]` dtype,dataframe,2022-02-24T22:24:48Z
8212,CLOSED,âš ï¸ Upstream CI failed âš ï¸,upstream,2021-10-04T17:20:58Z
8211,CLOSED,âš ï¸ Upstream CI failed âš ï¸,,2021-10-04T14:54:20Z
8210,CLOSED,Bug: flaky plugin - unexpected keyword argument 'reruns',needs info,2021-10-20T12:53:06Z
8208,CLOSED,s3fs and other extras not listed as extras in setup.py,,2021-10-01T17:38:09Z
8207,CLOSED,âš ï¸ Upstream CI failed âš ï¸,,2021-10-04T14:56:17Z
8204,CLOSED,âš ï¸ Upstream CI failed âš ï¸,,2021-10-01T01:01:38Z
8203,CLOSED,âš ï¸ Upstream CI failed âš ï¸,upstream,2021-10-01T15:12:19Z
8201,CLOSED,Correct fastparquet call,dataframe, parquet,2021-10-20T14:41:57Z
8190,CLOSED,Support assignment of scalars based on boolean indexes,dataframe,2021-10-01T15:22:03Z
8189,CLOSED,Read the docs permissions,,2021-09-29T11:31:40Z
8188,CLOSED,Documentation build instructions fail using conda,documentation,2021-10-07T14:32:36Z
8183,CLOSED,OSError 22 when df.compute(),needs info,2021-09-29T18:23:11Z
8182,CLOSED,Usage of numpy quantile/percentile functions on da.array broken on distributed scheduler in 2021.08.0,,2021-09-27T19:38:24Z
8179,CLOSED,improve SSHCluster docs for setup,,2021-09-28T13:31:08Z
8178,CLOSED,`to_parquet` fails with dataframe built from futures,,2023-02-27T05:03:24Z
8175,CLOSED,When updating a parquet dataset on S3 using arrow-engine it fails reading the schema (_get_dataset_offset),parquet,2021-09-28T19:49:55Z
8173,CLOSED,`to_delayed(optimize_graph=False)` objects often have incorrect `__dask_layers__`,delayed, needs attention,2021-12-20T20:03:09Z
8172,OPEN,botocore error when writing parquet to S3,dataframe, io, parquet,2021-11-07T10:42:38Z
8169,CLOSED,32bit test suite: pandas 1.3.3 "Buffer dtype mismatch",needs attention,2022-03-28T19:38:40Z
8168,CLOSED,Support Path objects in from_zarr,good first issue, array,2021-10-19T14:28:03Z
8164,CLOSED,Assignment silently fails for array with unknown chunk size,array,2021-09-23T16:15:05Z
8163,CLOSED,Error when plotting xarray dataset while using dask,,2021-09-22T07:35:14Z
8161,CLOSED,Incompatible storage_options handling between dd.read_csv and dd.read_parquet,dataframe, io, parquet, needs attention,2022-03-01T17:42:03Z
8159,CLOSED,Repartition by frequency errors for DatetimeIndex,dataframe, needs info,2021-09-21T13:57:15Z
8156,CLOSED,Improve `DataFrame.query` docstring with local variable example,good first issue, dataframe, documentation, needs attention,2022-04-06T21:05:43Z
8154,CLOSED,`git clone` issue in gpuCI build,,2021-09-16T14:56:12Z
8152,OPEN,Warn if `num_workers == 1`,good second issue,2022-03-01T17:54:27Z
8147,OPEN,Unified data reader / writer interfaces,io, parquet, needs attention,2022-03-24T21:18:41Z
8145,CLOSED,to_parquet fails when append=True,dataframe, io, parquet, needs attention,2022-05-16T21:23:56Z
8141,CLOSED,`.corr()` takes orders of magnitude longer than `np.corrcoef()`,array, needs info,2021-10-14T14:19:18Z
8140,CLOSED,`.visualize()` returns wrong graph when having multiple arithmetic operations,,2021-09-14T19:49:21Z
8137,CLOSED,Test failure with pandas 1.3.3,dataframe, upstream,2021-09-21T16:57:44Z
8135,CLOSED,Potential inconsistency in `dask.delayed` best practices,needs info,2021-09-24T11:19:43Z
8132,CLOSED,Parquet enhancements,dataframe, io, parquet,2022-03-01T17:58:08Z
8131,CLOSED,Use of `da.where` before `da.einsum` on a chunked array produces incorrectly sized result,array,2022-04-12T09:24:23Z
8119,CLOSED,merge() with how="cross" does not work,dataframe, needs attention,2022-03-17T13:53:05Z
8118,CLOSED,df.loc[id] often hangs though executed by worker,dataframe,2021-09-20T13:46:32Z
8115,CLOSED,how to get info (total memory usage) of a dask.dataframe?,good first issue, dataframe,2021-10-18T19:33:29Z
8113,CLOSED,Incorrect divisions when doing an inner join between 2 1-partition dataframes,dataframe,2021-10-04T14:00:15Z
8111,CLOSED,Inconsistent Tokenization due to Lazy Registration,,2021-09-27T21:11:05Z
8110,CLOSED,reshape constructs extremely large chunks,array, needs info,2021-12-14T16:57:08Z
8108,CLOSED,fsspec test failing on main,,2021-09-01T17:15:26Z
8105,CLOSED,`TypeError` in `asanyarray` `__array_function__`,array,2021-09-07T15:34:02Z
8101,CLOSED,`test_tsqr_uncertain` failing on gpuCI,array,2021-09-07T13:35:36Z
8099,CLOSED,Dask running out of memory reading in csv files post 2021.04.0 update,needs info,2021-09-13T21:04:30Z
8096,CLOSED,AttributeError: 'SingleBlockManager' object has no attribute 'axes',dataframe, needs info,2021-09-07T13:30:24Z
8095,CLOSED,Can you add some meaningfull examples?,,2021-08-30T15:31:36Z
8094,CLOSED,`make_people` should work with `processes` scheduler,bag,2021-09-01T14:43:02Z
8089,CLOSED,dask/distributed failing randomly (KeyError: 'dask.dataframe'),dataframe,2021-08-27T14:57:08Z
8088,CLOSED,`DataFrame.head` shouldn't warn when there's one partition,good first issue, dataframe,2021-10-14T16:39:21Z
8087,CLOSED,Inconsistency and errors between different parquet engines on Spark-generated parquet files.,dataframe, io, parquet,2021-10-27T16:09:40Z
8085,CLOSED,TypeError: '<=' not supported between instances of 'int' and 'str' if dask.dataframe use map_partitions for twice,dataframe,2022-09-13T22:15:29Z
8082,CLOSED,Dask Dataframe index renaming doesn't work in place,dataframe,2021-10-14T08:20:49Z
8081,CLOSED,DataFrame.assign doesn't support "dependent" columns,good first issue, dataframe,2021-10-11T13:57:07Z
8078,CLOSED,`da.percentile` of dask array with dask 2021.8.1 requires pandas,,2021-08-25T23:35:23Z
8075,CLOSED,DataFrame.shuffle not in documentation,,2021-08-23T22:49:12Z
8074,CLOSED,Dask Arrow DataFrame,dataframe, discussion,2022-03-01T18:07:06Z
8071,CLOSED,read_parquet equality (=) filter returns incorrect result,dataframe, io, parquet,2021-10-27T23:17:28Z
8070,CLOSED,Parquet Reading Failed due to `aiobotocore` release,,2021-08-20T16:48:04Z
8065,CLOSED,Possible docstring error for `DataFrame.quantile`,,2021-08-19T17:07:21Z
8063,CLOSED,gpuCI failing,,2021-08-19T00:38:56Z
8062,CLOSED,Flaky `test_create_metadata_file`,dataframe, io, tests, parquet, needs attention,2024-01-17T14:30:53Z
8059,CLOSED,Writing large parquet files to public S3 bucket with pyarrow failing,dataframe, io, parquet,2022-03-24T22:30:56Z
8058,OPEN,[Discussion] Improve Parquet-Metadata Processing in read_parquet,dataframe, io, discussion, parquet,2021-10-12T07:18:17Z
8056,CLOSED,Overwriting parquet dataset on S3 doesn't create a new bucket,dataframe, io, parquet,2021-08-24T16:50:58Z
8051,CLOSED,High memory usage for file to file streaming - h5py and zarr,,2021-08-18T19:58:45Z
8048,CLOSED,da.histogram just loops and never completes on a small dataset.,array, needs info,2021-09-10T18:42:37Z
8046,CLOSED,Add deltalake read functionality,io, needs attention,2021-11-02T22:26:41Z
8045,OPEN,Calculate valid partition divisions to avoid parser EOF error when CSV rows contain unescaped newlines,dataframe, io, needs attention,2021-10-25T01:48:31Z
8042,CLOSED,dask dataframe from delayeds of dask dataframes,dataframe, needs info,2021-10-14T17:20:44Z
8036,CLOSED,Upstream CI failing,,2021-10-19T13:42:46Z
8032,CLOSED,HTML repr for dask.config.config,,2021-08-19T01:41:48Z
8031,CLOSED,Processing large remote Parquet datsets,dataframe, io, parquet, needs attention,2022-05-27T16:04:56Z
8030,CLOSED,Disabling loading consolidated Parquet `_metadata`,dataframe, io, parquet,2021-08-24T17:12:49Z
8028,CLOSED,Parquet filepath parsing error,dataframe, io, parquet, needs attention,2022-04-28T17:30:09Z
8027,CLOSED,Parquet `_metadata` too large to parse,dataframe, io, parquet,2022-05-13T15:26:43Z
8026,CLOSED,S3 rate limit encountered during DataFrame computation,dataframe, io, parquet,2022-05-05T15:54:22Z
8023,CLOSED,unable to read multiple hdfs after dask update,,2021-08-13T17:03:51Z
